{
  "fetched_at": "2026-08-18T09:50:46Z",
  "files": [
    "profession.json",
    "specializations.json",
    "traits.json",
    "skills.json",
    "itemstats.json",
    "equipment.json",
    "upgrades.json",
    "consumables.json"
  ],
  "game_build_id": 205655,
  "mode": "wvw",
  "schema_version": 1,
  "unresolved_references": []
}
